{
  "id": "ocean_light",
  "description": {
    "en": "Ocean theme"
  },
  "mode": "light",
  "author": "F.Moser",
  "sound": "switch-on",
  "colors": {
    "mx_ui_text": {
      "visibility": "visible",
      "color": "rgb(53,53,53)"
    },
    "mx_ui_link": {
      "visibility": "visible",
      "color": "rgb(17,176,248)"
    },
    "mx_ui_input_accent": {
      "visibility": "visible",
      "color": "rgb(17,176,248)"
    },
    "mx_ui_text_faded": {
      "visibility": "visible",
      "color": "rgba(53,53,53,0.5)"
    },
    "mx_ui_hidden": {
      "visibility": "visible",
      "color": "rgba(2,186,253,0)"
    },
    "mx_ui_border": {
      "visibility": "visible",
      "color": "rgba(156,156,156,0.2)"
    },
    "mx_ui_background": {
      "visibility": "visible",
      "color": "rgb(255,255,255)"
    },
    "mx_ui_background_accent": {
      "visibility": "visible",
      "color": "rgb(252,252,252)"
    },
    "mx_ui_background_faded": {
      "visibility": "visible",
      "color": "rgb(250,250,250)"
    },
    "mx_ui_background_contrast": {
      "visibility": "visible",
      "color": "rgb(245,245,245)"
    },
    "mx_ui_background_transparent": {
      "visibility": "visible",
      "color": "rgba(245,245,245,0.4)"
    },
    "mx_ui_shadow": {
      "visibility": "visible",
      "color": "rgba(61,61,61,0.09)"
    },
    "mx_map_background": {
      "visibility": "visible",
      "color": "rgb(255,255,255)"
    },
    "mx_map_feature_highlight": {
      "visibility": "visible",
      "color": "rgb(255,0,255)"
    },
    "mx_map_hillshade_shadow": {
      "visibility": "visible",
      "color": "rgba(145,145,145,0.1)"
    },
    "mx_map_hillshade_highlight": {
      "visibility": "visible",
      "color": "rgba(255,255,255,0.1)"
    },
    "mx_map_mask": {
      "visibility": "visible",
      "color": "rgba(153,153,153,0.4)"
    },
    "mx_map_text_place": {
      "visibility": "visible",
      "color": "rgba(47,47,47,0.8)"
    },
    "mx_map_text_place_outline": {
      "visibility": "visible",
      "color": "rgba(48,48,48,0)"
    },
    "mx_map_text_road": {
      "visibility": "none",
      "color": "rgba(121,121,121,0.5)"
    },
    "mx_map_text_road_outline": {
      "visibility": "none",
      "color": "rgba(220,220,220,0.2)"
    },
    "mx_map_text_water": {
      "visibility": "visible",
      "color": "rgba(37,78,101,0.9)"
    },
    "mx_map_text_water_outline": {
      "visibility": "visible",
      "color": "rgba(46,60,71,0.1)"
    },
    "mx_map_water": {
      "visibility": "visible",
      "color": "rgb(189,209,227)"
    },
    "mx_map_bathymetry_high": {
      "visibility": "visible",
      "color": "rgba(109,156,190,0.5)"
    },
    "mx_map_bathymetry_low": {
      "visibility": "visible",
      "color": "rgba(11,16,19,0.5)"
    },
    "mx_map_road": {
      "visibility": "none",
      "color": "rgb(255,255,255)"
    },
    "mx_map_road_border": {
      "visibility": "none",
      "color": "rgba(220,220,220,0.5)"
    },
    "mx_map_building": {
      "visibility": "visible",
      "color": "rgba(220,220,220,0.5)"
    },
    "mx_map_boundary_un_1": {
      "visibility": "visible",
      "color": "rgba(38,38,38,0.3)"
    },
    "mx_map_boundary_un_2": {
      "visibility": "visible",
      "color": "rgba(38,38,38,0.3)"
    },
    "mx_map_boundary_un_3": {
      "visibility": "visible",
      "color": "rgba(38,38,38,0.3)"
    },
    "mx_map_boundary_un_4": {
      "visibility": "visible",
      "color": "rgba(38,38,38,0.3)"
    },
    "mx_map_boundary_un_8": {
      "visibility": "visible",
      "color": "rgba(38,38,38,0.3)"
    },
    "mx_map_boundary_un_9": {
      "visibility": "visible",
      "color": "rgba(38,38,38,0.3)"
    },
    "mx_map_boundary_un_6": {
      "visibility": "visible",
      "color": "rgba(121,121,121,0.6)"
    }
  }
}
