{
  "id": "classic_dark",
  "description": {
    "en": "Dark gray theme."
  },
  "author": "F.Moser",
  "mode": "dark",
  "sound": "switch-off",
  "colors": {
    "mx_ui_text": {
      "visibility": "visible",
      "color": "rgb(235,235,235)",
      "font": "Noto Sans"
    },
    "mx_ui_link": {
      "visibility": "visible",
      "color": "rgb(17,176,248)"
    },
    "mx_ui_input_accent": {
      "visibility": "visible",
      "color": "rgb(17,176,248)"
    },
    "mx_ui_text_faded": {
      "visibility": "visible",
      "color": "rgb(192,192,192)"
    },
    "mx_ui_hidden": {
      "visibility": "visible",
      "color": "rgba(0,84,147,0)"
    },
    "mx_ui_border": {
      "visibility": "visible",
      "color": "rgba(255,255,255,0.1)"
    },
    "mx_ui_background": {
      "visibility": "visible",
      "color": "rgb(66,66,66)"
    },
    "mx_ui_background_accent": {
      "visibility": "visible",
      "color": "rgb(70,70,70)"
    },
    "mx_ui_background_faded": {
      "visibility": "visible",
      "color": "rgb(51,51,51)"
    },
    "mx_ui_background_contrast": {
      "visibility": "visible",
      "color": "rgb(58,58,58)"
    },
    "mx_ui_background_transparent": {
      "visibility": "visible",
      "color": "rgba(66,66,66,0.5)"
    },
    "mx_ui_shadow": {
      "visibility": "visible",
      "color": "rgba(28,28,28,0.3)"
    },
    "mx_map_background": {
      "visibility": "visible",
      "color": "rgb(48,48,48)"
    },
    "mx_map_feature_highlight": {
      "visibility": "visible",
      "color": "rgb(0,255,0)"
    },
    "mx_map_hillshade_shadow": {
      "visibility": "visible",
      "color": "rgba(0,0,0,0.1)"
    },
    "mx_map_hillshade_highlight": {
      "visibility": "visible",
      "color": "rgba(121,121,121,0.2)"
    },
    "mx_map_mask": {
      "visibility": "visible",
      "color": "rgba(0,0,0,0.2)"
    },
    "mx_map_text_place": {
      "visibility": "visible",
      "color": "rgba(186,186,186,0.9)",
      "font": "Noto Sans Regular"
    },
    "mx_map_text_road": {
      "visibility": "visible",
      "color": "rgb(164,164,164)",
      "font": "Noto Sans Medium"
    },
    "mx_map_text_water": {
      "visibility": "visible",
      "color": "rgba(56,56,56,0.9)",
      "font": "Libre Baskerville Italic"
    },
    "mx_map_text_water_outline": {
      "visibility": "visible",
      "color": "rgba(46,60,71,0.1)"
    },
    "mx_map_water": {
      "visibility": "visible",
      "color": "rgb(143,143,143)"
    },
    "mx_map_bathymetry_high": {
      "visibility": "visible",
      "color": "rgba(135,135,135,0.87)"
    },
    "mx_map_bathymetry_low": {
      "visibility": "visible",
      "color": "rgba(23,22,22,0.91)"
    },
    "mx_map_bathymetry_lines": {
      "visibility": "none",
      "color": "rgb(255,255,255)"
    },
    "mx_map_road": {
      "visibility": "visible",
      "color": "rgb(5,5,5)"
    },
    "mx_map_road_border": {
      "visibility": "visible",
      "color": "rgb(84,84,84)"
    },
    "mx_map_building": {
      "visibility": "visible",
      "color": "rgba(64,64,64,0.76)"
    },
    "mx_map_boundary_un_1": {
      "visibility": "visible",
      "color": "rgb(121,121,121)"
    },
    "mx_map_boundary_un_2": {
      "visibility": "visible",
      "color": "rgba(121,121,121,0.6)"
    },
    "mx_map_boundary_un_3": {
      "visibility": "visible",
      "color": "rgba(121,121,121,0.6)"
    },
    "mx_map_boundary_un_4": {
      "visibility": "visible",
      "color": "rgba(121,121,121,0.6)"
    },
    "mx_map_boundary_un_8": {
      "visibility": "visible",
      "color": "rgba(121,121,121,0.6)"
    },
    "mx_map_boundary_un_9": {
      "visibility": "visible",
      "color": "rgba(121,121,121,0.6)"
    },
    "mx_map_boundary_un_6": {
      "visibility": "visible",
      "color": "rgba(121,121,121,0.6)"
    },
    "mx_map_text_land_outline": {
      "visibility": "visible",
      "color": "rgba(48,48,48,0.24)"
    },
    "mx_map_text_bathymetry_outline": {
      "visibility": "none",
      "color": "rgba(255,255,255,0.9)"
    },
    "mx_map_text_bathymetry": {
      "visibility": "none",
      "color": "rgba(0,71,102,0.9)",
      "font": "Varela Round Regular"
    },
    "mx_map_text_country_0_0": {
      "visibility": "visible",
      "color": "rgb(247,247,247)",
      "font": "Noto Sans Medium Italic"
    },
    "mx_map_text_country_0_1": {
      "visibility": "visible",
      "color": "rgb(255,255,255)",
      "font": "Noto Sans Regular"
    },
    "mx_map_text_country_0_2": {
      "visibility": "visible",
      "color": "rgb(255,255,255)",
      "font": "Noto Sans Italic"
    },
    "mx_map_text_country_0_3": {
      "visibility": "visible",
      "color": "rgb(255,255,255)",
      "font": "Noto Sans Regular"
    },
    "mx_map_text_country_0_4": {
      "visibility": "visible",
      "color": "rgb(255,255,255)",
      "font": "Noto Sans Regular"
    },
    "mx_map_text_country_0_5": {
      "visibility": "visible",
      "color": "rgb(255,255,255)",
      "font": "Noto Sans Italic"
    },
    "mx_map_text_country_0_99": {
      "visibility": "visible",
      "color": "rgb(255,255,255)",
      "font": "Noto Sans Regular"
    },
    "mx_map_text_country_1_1": {
      "visibility": "visible",
      "color": "rgb(255,255,255)",
      "font": "Noto Sans Italic"
    }
  }
}
